{
  "schema": "c028-workflow-metadata-v1",
  "repository": "0xNebulaLumina/java-tron-to-rust-rebirth",
  "candidate_run_id": 1001,
  "signing_run_id": 1002,
  "signing_workflow": ".github/workflows/c028-release-sign.yml",
  "signing_workflow_sha": "1111111111111111111111111111111111111111",
  "unsigned_artifact_name": "c028-unsigned-release-1-bbbbbbbbbbbbbbbbbbbbbbbbbbbbbbbbbbbbbbbbbbbbbbbbbbbbbbbbbbbbbbbb",
  "unsigned_artifact_sha256": "bbbbbbbbbbbbbbbbbbbbbbbbbbbbbbbbbbbbbbbbbbbbbbbbbbbbbbbbbbbbbbbb",
  "signed_artifact_name": "c028-candidate-release-1-aaaaaaaaaaaaaaaaaaaaaaaaaaaaaaaaaaaaaaaaaaaaaaaaaaaaaaaaaaaaaaaa",
  "signed_archive_name": "c028-candidate.tar.gz",
  "candidate_sha256": "aaaaaaaaaaaaaaaaaaaaaaaaaaaaaaaaaaaaaaaaaaaaaaaaaaaaaaaaaaaaaaaa",
  "release_id": "release-1",
  "channel": "stable",
  "source_revision": "2222222222222222222222222222222222222222"
}
